{
  "contract": "specialist-report",
  "version": 2,
  "task_id": "session-cookie",
  "build_revision": 0,
  "specialist": "security",
  "trigger_reasons": [
    "path:src/auth/session.ts",
    "standards: trust boundary for session cookies"
  ],
  "summary": "Session cookie is set without Secure and HttpOnly flags on a sensitive auth path.",
  "scope_review": {
    "reviewed_paths": ["src/auth/session.ts"],
    "unavailable_context": ["production TLS terminator config"]
  },
  "findings": [
    {
      "id": "S1",
      "severity": "MAJOR",
      "category": "security",
      "file": "src/auth/session.ts",
      "lines": "14-18",
      "quote": "res.setHeader('Set-Cookie', `sid=${token}; Path=/`)",
      "trigger": "Issue a session after login and inspect Set-Cookie.",
      "expected": "Session cookie includes HttpOnly, Secure, SameSite, and a restrictive Path.",
      "actual": "Only Path=/ is set; cookie is readable by script and sendable on cleartext if exposed.",
      "impact": "XSS can steal the session; mixed-content or mis-terminated TLS increases theft risk.",
      "fix": "Set HttpOnly; Secure; SameSite=Lax or Strict; avoid overly broad Path if applicable.",
      "evidence_basis": "static_proof",
      "evidence_detail": "The Set-Cookie string literal contains no HttpOnly or Secure attributes."
    }
  ],
  "non_findings": [
    "No hardcoded long-lived API keys in the supplied session module.",
    "Token value itself is not logged in the supplied snippet."
  ],
  "open_questions": [
    "Is TLS terminated at a proxy that already rewrites cookie flags? Not in packet."
  ],
  "recommended_to_auditor": ["S1"],
  "research_brief": null
}
